Id,Url,Title,Description,ParseTime,CreatedTime
f0c9498c-22d7-4f64-a8bd-4554369565ae,/Press-sluzhba/Novosti/window/46370642/,Заседание Совета по научной деятельности Московского университета  МВД России имени В.Я. Кикотя»,Особое внимание было уделено вопросам подготовки научно-педагогических и научных кадров на кафедрах Университета,Дата 29 Января  17:00                3,01/01/0001 00:00:00
5e696f29-aa53-41ef-8d27-40eb698f2244,/Press-sluzhba/Novosti/window/46279548/,"В Университете состоялась выставка «Великая Отечественная война в советской и российской нумизматике», посвященная Дню полного освобождения Ленинграда от фашистской блокады","Знакомство с уникальной нумизматической коллекцией играет важную роль в повышении уровня патриотического, нравственного и эстетического воспитания личного состава Университета",Дата 26 Января  18:00                3,01/01/0001 00:00:00
2b52601d-b1a4-4fa4-be2b-c2c4c6da62f5,/Press-sluzhba/Novosti/window/46254293/,Курсант Университета завоевала серебро на Первенстве Москвы по легкой атлетике,Поздравляем Ольгу с победой и желаем новых спортивных достижений!,Дата 26 Января  11:52                1,01/01/0001 00:00:00
66341312-cf1f-44f6-b063-76f02043e685,/Press-sluzhba/Novosti/window/46278986/,"Авторское стихотворение «Потомки» ветерана органов внутренних дел, жителя блокадного Ленинграда - Вадима Владимировича Верковского",,Дата 26 Января  09:00                                1,01/01/0001 00:00:00
e8e05322-b6f4-4597-85a3-f160ea5e4ee1,/Press-sluzhba/Novosti/window/46229879/,"Межвузовский круглый стол, посвященный Дню российского студенчества «Цифровизация правоотношений: проблемы теории и практики глазами молодых ученых»",В ходе дискуссии были рассмотрены наиболее актуальные вопросы,Дата 25 Января  18:30                4,01/01/0001 00:00:00
184b60bf-7d1e-4c12-a3ee-dc530047f04d,/Press-sluzhba/Novosti/window/46163713/,В Московском университете МВД России имени В.Я. Кикотя состоялся цикл мероприятий в рамках реализации проекта «Пропаганда научных знаний»,"В мероприятиях приняли участие профессорско-преподавательский состав, адъюнкты факультета подготовки научно-педагогических и научных кадров, члены научного кружка кафедры",Дата 24 Января  12:20                2,01/01/0001 00:00:00
57ffbbb6-df88-4935-b591-fc4a007d2f47,/Press-sluzhba/Novosti/window/46131735/,День донора в Московском университете МВД России имени В.Я. Кикотя,"В мероприятии приняли участие курсанты, слушатели, сотрудники и работники Университета",Дата 23 Января  15:50                7,01/01/0001 00:00:00
da567fec-ccdd-430a-b9ae-01b659220062,/Press-sluzhba/Novosti/window/45974460/,Представители Университета стали победителями и призерами Чемпионата и Первенства Центрального федерального округа по легкой атлетике,Поздравляем с победой и желаем новых спортивных достижений!,Дата 19 Января  16:00                5,01/01/0001 00:00:00
a70b9f6e-4882-46d6-bb15-4db812039ccd,/Press-sluzhba/Novosti/window/46005304/,"В Храме-часовне во имя Архистратига Божьего Михаила при Московском университете МВД России имени В.Я. Кикотя состоялась Божественная Литургия, посвященная великому двунадесятому празднику Крещению Господня и Великому освящению воды",В этот светлый и радостный день настоятель Храма-часовни во имя Архистратига Божьего Михаила иерей Павел Усачев совершил праздничный молебен,Дата 19 Января  13:45                7,01/01/0001 00:00:00
